{
  "applied_count": 13,
  "expected_count": 13,
  "feature_package_id": "feature-package/feat-task-spec-test-strategy",
  "graph_digest_after": "sha256:bcad317ae671cd2752968bff79f4afcfadde6c6a17ccfd3ef843d268f38936fd",
  "graph_revision_after": 515,
  "graph_revision_before": 514,
  "node_ids": [
    "SYS-TASK-SPEC-TEST-STRATEGY-P01",
    "SYS-TASK-SPEC-TEST-STRATEGY-P02",
    "SYS-TASK-SPEC-TEST-STRATEGY-P03",
    "SYS-TASK-SPEC-TEST-STRATEGY-P04",
    "SYS-TASK-SPEC-TEST-STRATEGY-P05",
    "SYS-TASK-SPEC-TEST-STRATEGY-P06",
    "SYS-TASK-SPEC-TEST-STRATEGY-P07",
    "SYS-TASK-SPEC-TEST-STRATEGY-P08",
    "SYS-TASK-SPEC-TEST-STRATEGY-P09",
    "SYS-TASK-SPEC-TEST-STRATEGY-P10",
    "SYS-TASK-SPEC-TEST-STRATEGY-P11",
    "SYS-TASK-SPEC-TEST-STRATEGY-P12",
    "SYS-TASK-SPEC-TEST-STRATEGY-P13"
  ],
  "operation": "registered",
  "output_path": ".dev-graph/state/graph.json",
  "parent_feature": "feat-task-spec-test-strategy",
  "phase_refs": [
    "P01",
    "P02",
    "P03",
    "P04",
    "P05",
    "P06",
    "P07",
    "P08",
    "P09",
    "P10",
    "P11",
    "P12",
    "P13"
  ],
  "registered_at": "2026-07-24T23:10:48.596612Z",
  "schema_version": "1.0.0",
  "source_digest": "sha256:7d185f453466523edcc7c6071fde7c24001612da367de329c10ba13c82a43bae",
  "status": "registered",
  "supersedes_source_digest": null
}
