{
  "applied_count": 13,
  "expected_count": 13,
  "feature_package_id": "feature-package/feat-hub-foundation",
  "graph_digest_after": "sha256:d465eebd11834b31da0f504912ccf77ab1d40a1f1824621d93abd5746acd960d",
  "graph_revision_after": 1,
  "graph_revision_before": 0,
  "node_ids": [
    "SYS-HUB-FOUNDATION-P01",
    "SYS-HUB-FOUNDATION-P02",
    "SYS-HUB-FOUNDATION-P03",
    "SYS-HUB-FOUNDATION-P04",
    "SYS-HUB-FOUNDATION-P05",
    "SYS-HUB-FOUNDATION-P06",
    "SYS-HUB-FOUNDATION-P07",
    "SYS-HUB-FOUNDATION-P08",
    "SYS-HUB-FOUNDATION-P09",
    "SYS-HUB-FOUNDATION-P10",
    "SYS-HUB-FOUNDATION-P11",
    "SYS-HUB-FOUNDATION-P12",
    "SYS-HUB-FOUNDATION-P13"
  ],
  "output_path": ".dev-graph/state/graph.json",
  "parent_feature": "feat-hub-foundation",
  "phase_refs": [
    "P01",
    "P02",
    "P03",
    "P04",
    "P05",
    "P06",
    "P07",
    "P08",
    "P09",
    "P10",
    "P11",
    "P12",
    "P13"
  ],
  "registered_at": "2026-07-17T08:05:32.590614Z",
  "schema_version": "1.0.0",
  "source_digest": "sha256:d6cce29a0f3ba6d5f3988e3d4310201fc8be0fee08688def59ad76399cb4b12a",
  "status": "registered"
}
