{
  "applied_count": 13,
  "expected_count": 13,
  "feature_package_id": "feature-package/feat-doc-governance-portability",
  "graph_digest_after": "sha256:b10759b941aa97793cd1143026bcae50d66dcba4b701aeac469bd59a8a053501",
  "graph_revision_after": 331,
  "graph_revision_before": 330,
  "node_ids": [
    "SYS-DOC-GOVERNANCE-PORTABILITY-P01",
    "SYS-DOC-GOVERNANCE-PORTABILITY-P02",
    "SYS-DOC-GOVERNANCE-PORTABILITY-P03",
    "SYS-DOC-GOVERNANCE-PORTABILITY-P04",
    "SYS-DOC-GOVERNANCE-PORTABILITY-P05",
    "SYS-DOC-GOVERNANCE-PORTABILITY-P06",
    "SYS-DOC-GOVERNANCE-PORTABILITY-P07",
    "SYS-DOC-GOVERNANCE-PORTABILITY-P08",
    "SYS-DOC-GOVERNANCE-PORTABILITY-P09",
    "SYS-DOC-GOVERNANCE-PORTABILITY-P10",
    "SYS-DOC-GOVERNANCE-PORTABILITY-P11",
    "SYS-DOC-GOVERNANCE-PORTABILITY-P12",
    "SYS-DOC-GOVERNANCE-PORTABILITY-P13"
  ],
  "operation": "registered",
  "output_path": ".dev-graph/state/graph.json",
  "parent_feature": "feat-doc-governance-portability",
  "phase_refs": [
    "P01",
    "P02",
    "P03",
    "P04",
    "P05",
    "P06",
    "P07",
    "P08",
    "P09",
    "P10",
    "P11",
    "P12",
    "P13"
  ],
  "registered_at": "2026-07-22T02:32:48.360811Z",
  "schema_version": "1.0.0",
  "source_digest": "sha256:d33c318dbf7cf3f407daf50b396531f67b365d7d8743146223f46224a8958aee",
  "status": "registered",
  "supersedes_source_digest": null
}
