{
  "applied_count": 13,
  "expected_count": 13,
  "feature_package_id": "feature-package/feat-mvp-first-scheduling",
  "graph_digest_after": "sha256:4f4d2ee4e90e2f200215b1175a9b2097711eafdc24d44d3d0dd329d407e74623",
  "graph_revision_after": 384,
  "graph_revision_before": 383,
  "node_ids": [
    "SYS-MVP-FIRST-SCHEDULING-P01",
    "SYS-MVP-FIRST-SCHEDULING-P02",
    "SYS-MVP-FIRST-SCHEDULING-P03",
    "SYS-MVP-FIRST-SCHEDULING-P04",
    "SYS-MVP-FIRST-SCHEDULING-P05",
    "SYS-MVP-FIRST-SCHEDULING-P06",
    "SYS-MVP-FIRST-SCHEDULING-P07",
    "SYS-MVP-FIRST-SCHEDULING-P08",
    "SYS-MVP-FIRST-SCHEDULING-P09",
    "SYS-MVP-FIRST-SCHEDULING-P10",
    "SYS-MVP-FIRST-SCHEDULING-P11",
    "SYS-MVP-FIRST-SCHEDULING-P12",
    "SYS-MVP-FIRST-SCHEDULING-P13"
  ],
  "operation": "registered",
  "output_path": ".dev-graph/state/graph.json",
  "parent_feature": "feat-mvp-first-scheduling",
  "phase_refs": [
    "P01",
    "P02",
    "P03",
    "P04",
    "P05",
    "P06",
    "P07",
    "P08",
    "P09",
    "P10",
    "P11",
    "P12",
    "P13"
  ],
  "registered_at": "2026-07-23T07:08:54.497661Z",
  "schema_version": "1.0.0",
  "source_digest": "sha256:55a34fe2a62841c0175b568204b4a1fde8e1fd04d1c0496bb4e0444e3cf86387",
  "status": "registered",
  "supersedes_source_digest": null
}
